{
  "schema_version": 1,
  "spec_version": "0.1.0",
  "id": "lifecycle.exit",
  "definition": {
    "id": "lifecycle.exit",
    "stability": "core",
    "summary": "Finish normally and return control to the host.",
    "inputs": [
      "status"
    ],
    "result": "never",
    "disconnect_behavior": "not_applicable"
  },
  "historical_implementations": [
    {
      "api": "paragon",
      "symbols": [
        "command 20"
      ],
      "status": "verified",
      "semantic_review": "reviewed",
      "evidence_statuses": [
        "observed"
      ],
      "provenance_ids": [
        "prov.paragon.lifecycle-exit.1"
      ],
      "covered": true
    }
  ],
  "adapter_status": [
    {
      "adapter": "daydream",
      "kind": "historical",
      "implementation": "ods_tools.adapters.daydream.DayDreamAdapter",
      "conformance": "host-and-c-tested",
      "supported": true
    },
    {
      "adapter": "host-simulator",
      "kind": "reference",
      "implementation": "ods_tools.adapters.host.HostAdapter",
      "conformance": "unspecified",
      "supported": true
    }
  ],
  "summary": {
    "historical_implementation_count": 1,
    "covered_historical_implementation_count": 1,
    "adapter_count": 2
  }
}
