{
  "schema_version": 1,
  "spec_version": "0.1.0",
  "id": "session.identity",
  "definition": {
    "id": "session.identity",
    "stability": "core",
    "summary": "Return stable caller identity fields available from the host.",
    "inputs": [],
    "result": "identity",
    "disconnect_behavior": "not_applicable"
  },
  "historical_implementations": [
    {
      "api": "abbs",
      "symbols": [
        "UserName",
        "UserNumber"
      ],
      "status": "verified",
      "semantic_review": "provisional",
      "evidence_statuses": [
        "documented"
      ],
      "provenance_ids": [
        "prov.abbs.session-identity.1"
      ],
      "covered": true
    },
    {
      "api": "daydream",
      "symbols": [
        "GetAccount"
      ],
      "status": "partial",
      "semantic_review": "provisional",
      "evidence_statuses": [],
      "provenance_ids": [],
      "covered": false
    },
    {
      "api": "paragon",
      "symbols": [
        "command 13",
        "command 14",
        "mxGetIntInfo",
        "mxGetStrInfo"
      ],
      "status": "partial",
      "semantic_review": "reviewed",
      "evidence_statuses": [
        "documented"
      ],
      "provenance_ids": [
        "prov.paragon.session-identity.1"
      ],
      "covered": true
    }
  ],
  "adapter_status": [
    {
      "adapter": "daydream",
      "kind": "historical",
      "implementation": "ods_tools.adapters.daydream.DayDreamAdapter",
      "conformance": "host-and-c-tested",
      "supported": true
    },
    {
      "adapter": "host-simulator",
      "kind": "reference",
      "implementation": "ods_tools.adapters.host.HostAdapter",
      "conformance": "unspecified",
      "supported": true
    }
  ],
  "summary": {
    "historical_implementation_count": 3,
    "covered_historical_implementation_count": 2,
    "adapter_count": 2
  }
}
