{
  "schema_version": 1,
  "spec_version": "0.1.0",
  "id": "terminal.write",
  "definition": {
    "id": "terminal.write",
    "stability": "core",
    "summary": "Write bytes or text to the caller terminal.",
    "inputs": [
      "data"
    ],
    "result": "void",
    "disconnect_behavior": "must_surface"
  },
  "historical_implementations": [
    {
      "api": "abbs",
      "symbols": [
        "Writeln",
        "Write"
      ],
      "status": "partial",
      "semantic_review": "provisional",
      "evidence_statuses": [],
      "provenance_ids": [],
      "covered": false
    },
    {
      "api": "ambos",
      "symbols": [
        "BBSWrite",
        "BBSPrintf"
      ],
      "status": "verified",
      "semantic_review": "provisional",
      "evidence_statuses": [
        "documented"
      ],
      "provenance_ids": [
        "prov.ambos.terminal-write.1"
      ],
      "covered": true
    },
    {
      "api": "daydream",
      "symbols": [
        "DDPutStr",
        "DDPrintf"
      ],
      "status": "verified",
      "semantic_review": "provisional",
      "evidence_statuses": [
        "documented"
      ],
      "provenance_ids": [
        "prov.daydream.terminal-write.1"
      ],
      "covered": true
    },
    {
      "api": "door-io",
      "symbols": [
        "DoorPrint"
      ],
      "status": "verified",
      "semantic_review": "provisional",
      "evidence_statuses": [
        "documented"
      ],
      "provenance_ids": [
        "prov.door-io.terminal-write.1"
      ],
      "covered": true
    },
    {
      "api": "paragon",
      "symbols": [
        "command 1",
        "mxPrint"
      ],
      "status": "verified",
      "semantic_review": "reviewed",
      "evidence_statuses": [
        "documented"
      ],
      "provenance_ids": [
        "prov.paragon.terminal-write.1"
      ],
      "covered": true
    }
  ],
  "adapter_status": [
    {
      "adapter": "daydream",
      "kind": "historical",
      "implementation": "ods_tools.adapters.daydream.DayDreamAdapter",
      "conformance": "host-and-c-tested",
      "supported": true
    },
    {
      "adapter": "host-simulator",
      "kind": "reference",
      "implementation": "ods_tools.adapters.host.HostAdapter",
      "conformance": "unspecified",
      "supported": true
    }
  ],
  "summary": {
    "historical_implementation_count": 5,
    "covered_historical_implementation_count": 4,
    "adapter_count": 2
  }
}
