{
  "schema_version": 1,
  "spec_version": "0.1.0",
  "id": "bbs.command",
  "definition": {
    "id": "bbs.command",
    "stability": "optional",
    "summary": "Request execution of a host command through an adapter-defined command namespace.",
    "inputs": [
      "command",
      "arguments"
    ],
    "result": "command_result",
    "disconnect_behavior": "must_surface"
  },
  "historical_implementations": [
    {
      "api": "daydream",
      "symbols": [
        "InternalCommand"
      ],
      "status": "verified",
      "semantic_review": "provisional",
      "evidence_statuses": [
        "documented"
      ],
      "provenance_ids": [
        "prov.daydream.bbs-command.1"
      ],
      "covered": true
    },
    {
      "api": "paragon",
      "symbols": [
        "mxMenuFunct",
        "message command field"
      ],
      "status": "verified",
      "semantic_review": "reviewed",
      "evidence_statuses": [
        "documented"
      ],
      "provenance_ids": [
        "prov.paragon.bbs-command.1"
      ],
      "covered": true
    }
  ],
  "adapter_status": [
    {
      "adapter": "daydream",
      "kind": "historical",
      "implementation": "ods_tools.adapters.daydream.DayDreamAdapter",
      "conformance": "host-and-c-tested",
      "supported": true
    },
    {
      "adapter": "host-simulator",
      "kind": "reference",
      "implementation": "ods_tools.adapters.host.HostAdapter",
      "conformance": "unspecified",
      "supported": true
    }
  ],
  "summary": {
    "historical_implementation_count": 2,
    "covered_historical_implementation_count": 2,
    "adapter_count": 2
  }
}
