{
  "schema_version": 1,
  "spec_version": "0.1.0",
  "id": "terminal.read_key",
  "definition": {
    "id": "terminal.read_key",
    "stability": "core",
    "summary": "Wait for and return one terminal input unit.",
    "inputs": [],
    "result": "key",
    "disconnect_behavior": "must_surface"
  },
  "historical_implementations": [
    {
      "api": "abbs",
      "symbols": [
        "GetKey"
      ],
      "status": "verified",
      "semantic_review": "provisional",
      "evidence_statuses": [
        "documented"
      ],
      "provenance_ids": [
        "prov.abbs.terminal-read-key.1"
      ],
      "covered": true
    },
    {
      "api": "daydream",
      "symbols": [
        "DDGetKey"
      ],
      "status": "verified",
      "semantic_review": "provisional",
      "evidence_statuses": [
        "documented"
      ],
      "provenance_ids": [
        "prov.daydream.terminal-read-key.1"
      ],
      "covered": true
    },
    {
      "api": "door-io",
      "symbols": [
        "DoorGetKey"
      ],
      "status": "verified",
      "semantic_review": "provisional",
      "evidence_statuses": [
        "documented"
      ],
      "provenance_ids": [
        "prov.door-io.terminal-read-key.1"
      ],
      "covered": true
    },
    {
      "api": "paragon",
      "symbols": [
        "command 8",
        "mxHotKey"
      ],
      "status": "verified",
      "semantic_review": "reviewed",
      "evidence_statuses": [
        "documented"
      ],
      "provenance_ids": [
        "prov.paragon.terminal-read-key.1"
      ],
      "covered": true
    }
  ],
  "adapter_status": [
    {
      "adapter": "daydream",
      "kind": "historical",
      "implementation": "ods_tools.adapters.daydream.DayDreamAdapter",
      "conformance": "host-and-c-tested",
      "supported": true
    },
    {
      "adapter": "host-simulator",
      "kind": "reference",
      "implementation": "ods_tools.adapters.host.HostAdapter",
      "conformance": "unspecified",
      "supported": true
    }
  ],
  "summary": {
    "historical_implementation_count": 4,
    "covered_historical_implementation_count": 4,
    "adapter_count": 2
  }
}
